# 📚 Índice dos Diários de Pesquisa-Ação

Este diretório contém os registros de todas as sessões de trabalho do projeto Tocantins Integrado, seguindo a metodologia de pesquisa-ação.

---

## 🔄 Ciclos de Pesquisa-Ação

### Ciclo 1: Concepção e Arquitetura (Nov 2025)

| Sessão | Data | Foco Principal | Arquivo |
| :--- | :--- | :--- | :--- |
| #01 | 10/11/2025 | Concepção inicial do projeto | [2025-11-10_sessao-01.md](2025-11-10_sessao-01.md) |
| #02 | 10/11/2025 | Implementação completa da arquitetura | [2025-11-10_sessao-02.md](2025-11-10_sessao-02.md) |
| #03 | 16/11/2025 | Artigo científico e sistema de continuidade | [2025-11-16_sessao-03.md](2025-11-16_sessao-03.md) |

### Ciclo 2: Desenvolvimento do MVP (Nov-Dez 2025)

| Sessão | Data | Foco Principal | Arquivo |
| :--- | :--- | :--- | :--- |
| #04 | 23/11/2025 | Estruturação de dados e inteligência | [2025-11-23_sessao-04.md](2025-11-23_sessao-04.md) |
| #05 | 26/11/2025 | Debug e refatoração de agentes | [2025-11-26_sessao-05.md](2025-11-26_sessao-05.md) |
| #06 | 28/11/2025 | Arquitetura RAG | [2025-11-28_sessao-06.md](2025-11-28_sessao-06.md) |
| #07 | 29/11/2025 | MVP Fase 1 | [2025-11-29_sessao-07.md](2025-11-29_sessao-07.md) |
| #08 | 30/11/2025 | Agente ECON com RAG completo | [2025-11-30_sessao-08.md](2025-11-30_sessao-08.md) |
| #09 | 01/12/2025 | Webhooks n8n | [2025-12-01_sessao-09.md](2025-12-01_sessao-09.md) |
| #10 | 02/12/2025 | Agentes dimensionais | [2025-12-02_sessao-10.md](2025-12-02_sessao-10.md) |

### Ciclo 3: Consolidação e Orquestração (Dez 2025)

| Sessão | Data | Foco Principal | Arquivo |
| :--- | :--- | :--- | :--- |
| #11 | 05/12/2025 | Integração de agentes | [2025-12-05_sessao-11.md](2025-12-05_sessao-11.md) |
| #12 | 06/12/2025 | Orquestrador V5.1 | [2025-12-06_sessao-12.md](2025-12-06_sessao-12.md) |
| #13 | 08/12/2025 | Correções e validação | [2025-12-08_sessao-13.md](2025-12-08_sessao-13.md) |
| #14 | 10/12/2025 | Migração V4→V5 | *(síntese em auxiliary)* |
| #15 | 15/12/2025 | Reorganização do repositório | [2025-12-15_sessao-15.md](2025-12-15_sessao-15.md) |

### Ciclo 4: Reinício Estruturado - PSB (Jan 2026+)

| Sessão | Data | Foco Principal | Arquivo |
| :--- | :--- | :--- | :--- |
| #16 | 05/01/2026 | Reinício com Sistema PSB | [2026-01-05_sessao-16.md](2026-01-05_sessao-16.md) |
| #17 | 08/01/2026 | Operacionalização da Governança CIG | [2026-01-08_sessao-17.md](2026-01-08_sessao-17.md) |
| #18 | 15/01/2026 | Integração de Código e Implantação de Workflows | [2026-01-15_sessao-18.md](2026-01-15_sessao-18.md) |

---

## 📝 Template para Novos Diários

Utilize o [TEMPLATE.md](TEMPLATE.md) para criar novos registros de sessão.

## 📁 Arquivos Auxiliares

Documentos complementares estão disponíveis em [`../auxiliary/`](../auxiliary/).

---

**Total de Sessões Documentadas:** 18
